{"image_id": null, "experiment_id": "ldr_001", "provenance": "test_fixture", "split": "golden", "session_id": "fixture-uncertain-endpoint", "image_path": null, "metadata": {"case": "uncertain_endpoint"}, "frame": {"usable": true, "occluded": false}, "components": [], "pins": [], "wire_endpoints": [], "connections": [{"from_component": "LDR", "from_pin": "OUT", "to_component": null, "to_pin": null, "confidence": 0.42, "status": "UNCERTAIN"}], "expected_connections": ["LDR OUT->Arduino A0"], "predicted_connections": [], "expected_state": "INSUFFICIENT_EVIDENCE", "predicted_state": "INSUFFICIENT_EVIDENCE"}
